{"schema":"ai-news-guides/1","schemaVersion":1,"generatedAt":"2026-10-31T15:26:06Z","count":84,"featured":[{"title":"Build Your AI Brain — Export & Visualize ChatGPT/Claude History","url":"https://alex2learn.com","author":"Alex Freedman","description":"Use Claude Code + Obsidian to organize all your AI conversations into a searchable, linked knowledge vault. Covers ChatGPT/Claude exports, vault setup, and Claude Code-driven tagging.","tags":["obsidian","claude-code","knowledge-management","workflow"],"dateAdded":"2026-04-29","type":"guide"}],"sources":[{"id":"bsky-simonw","name":"Bluesky: simonwillison.net","status":"ok","count":15,"error":null},{"id":"devto-ai","name":"dev.to: ai","status":"ok","count":40,"error":null},{"id":"devto-llm","name":"dev.to: llm","status":"ok","count":40,"error":null},{"id":"gh-agents-tutorial","name":"GitHub: agents tutorials","status":"ok","count":15,"error":null},{"id":"gh-awesome-llm","name":"GitHub: awesome llm lists","status":"ok","count":15,"error":null},{"id":"gh-llm-tutorial","name":"GitHub: llm tutorials","status":"ok","count":20,"error":null},{"id":"hn-ask","name":"Hacker News: Ask HN","status":"ok","count":30,"error":null},{"id":"hn-guide","name":"Hacker News: guides","status":"ok","count":1,"error":null},{"id":"hn-show","name":"Hacker News: Show HN","status":"ok","count":40,"error":null},{"id":"hn-tutorial","name":"Hacker News: tutorials","status":"ok","count":2,"error":null},{"id":"reddit-localllama","name":"r/LocalLLaMA","status":"ok","count":25,"error":null},{"id":"yt-aiexplained","name":"AI Explained","status":"ok","count":15,"error":null},{"id":"yt-anthropic","name":"Anthropic","status":"ok","count":11,"error":null},{"id":"yt-karpathy","name":"Andrej Karpathy","status":"ok","count":15,"error":null},{"id":"yt-openai","name":"OpenAI","status":"ok","count":15,"error":null},{"id":"yt-twominute","name":"Two Minute Papers","status":"ok","count":15,"error":null},{"id":"yt-yannic","name":"Yannic Kilcher","status":"ok","count":15,"error":null}],"items":[{"id":"71a5157f20f36517","title":"ikaijua/Awesome-AITools: Collection of AI-related utilities. Welcome to submit pull requests /收藏AI相关的实用工具，欢迎提交pull requests","url":"https://github.com/ikaijua/Awesome-AITools","source":"GitHub","sourceKind":"github","publishedAt":"2026-10-31T15:15:34Z","summary":"Collection of AI-related utilities. Welcome to submit pull requests /收藏AI相关的实用工具，欢迎提交pull requests","score":6264},{"id":"05ce2220cc642b8f","title":"mnfst/awesome-free-llm-apis: List of Permanent Free LLM API (API Keys)","url":"https://github.com/mnfst/awesome-free-llm-apis","source":"GitHub","sourceKind":"github","publishedAt":"2026-10-31T15:13:32Z","summary":"List of Permanent Free LLM API (API Keys)","score":11782},{"id":"c7f7e9fbc46c75ca","title":"hesreallyhim/awesome-claude-code: A hand-picked collection of the finest of resources for the most awesome of agents, Claude Code, the undisputed champion of coding companions, from the unstoppable team at Anthropic PBC (no affiliation). A delectable showcase of top tier skills, ambidextrous agents,","url":"https://github.com/hesreallyhim/awesome-claude-code","source":"GitHub","sourceKind":"github","publishedAt":"2026-10-31T15:05:40Z","summary":"A hand-picked collection of the finest of resources for the most awesome of agents, Claude Code, the undisputed champion of coding companions, from the unstoppable team at Anthropic PBC (no affiliation). A delectable showcase of top tier skills, ambidextrous agents…","score":56967},{"id":"2d9ee74558a27481","title":"wesammustafa/Claude-Code-Everything-You-Need-to-Know: Claude Code guide in three levels, Beginner to Advanced: hands-on lessons with checked exercises, every volatile fact cited to its source. Independent community guide.","url":"https://github.com/wesammustafa/Claude-Code-Everything-You-Need-to-Know","source":"GitHub","sourceKind":"github","publishedAt":"2026-10-31T14:28:33Z","summary":"Claude Code guide in three levels, Beginner to Advanced: hands-on lessons with checked exercises, every volatile fact cited to its source. Independent community guide.","score":3516},{"id":"b303ce5d47829266","title":"FlorianBruniaux/claude-code-ultimate-guide: The most comprehensive Claude Code guide: agentic workflows, hooks, skills, MCP servers, quizzes, and production-ready templates. 430K+ lines.","url":"https://github.com/FlorianBruniaux/claude-code-ultimate-guide","source":"GitHub","sourceKind":"github","publishedAt":"2026-10-31T12:43:16Z","summary":"The most comprehensive Claude Code guide: agentic workflows, hooks, skills, MCP servers, quizzes, and production-ready templates. 430K+ lines.","score":6305},{"id":"2a378199cd415c39","title":"alvinreal/awesome-opensource-ai: Curated list of the best truly open-source AI projects, models, tools, and infrastructure. Daily updated.","url":"https://github.com/alvinreal/awesome-opensource-ai","source":"GitHub","sourceKind":"github","publishedAt":"2026-10-31T08:03:10Z","summary":"Curated list of the best truly open-source AI projects, models, tools, and infrastructure. Daily updated.","score":4962},{"id":"0c06593fa9d7c8f6","title":"yibie/awesome-jev: A curated list of public projects, integrations, and discussions built on Jev — TypeSafe AI's System One model for typed decisions.","url":"https://github.com/yibie/awesome-jev","source":"GitHub","sourceKind":"github","publishedAt":"2026-10-31T02:36:22Z","summary":"A curated list of public projects, integrations, and discussions built on Jev — TypeSafe AI's System One model for typed decisions.","score":2516},{"id":"18b3215c1f731c84","title":"mauripsale/doc-adk-training: Learn to build, test, and deploy production-ready AI agents with this complete \"From Zero to Hero\" training course for the Google Agent Development Kit (ADK).","url":"https://github.com/mauripsale/doc-adk-training","source":"GitHub","sourceKind":"github","publishedAt":"2026-10-30T22:12:47Z","summary":"Learn to build, test, and deploy production-ready AI agents with this complete \"From Zero to Hero\" training course for the Google Agent Development Kit (ADK).","score":84},{"id":"edfb35c6c90d5e6c","title":"There are many futures. Which do you want to build?","url":"https://www.youtube.com/watch?v=o4D1J1YWjhg","source":"YouTube: OpenAI","sourceKind":"youtube","publishedAt":"2026-10-30T20:17:12Z","summary":"","score":0},{"id":"87831152da862b16","title":"steven2358/awesome-generative-ai: A curated list of modern Generative Artificial Intelligence projects and services","url":"https://github.com/steven2358/awesome-generative-ai","source":"GitHub","sourceKind":"github","publishedAt":"2026-10-30T17:31:48Z","summary":"A curated list of modern Generative Artificial Intelligence projects and services","score":12791},{"id":"ef8a80b227b14d0e","title":"OpenAI Claims It Just Did The Impossible","url":"https://www.youtube.com/watch?v=CWdTBLsbaQs","source":"YouTube: Two Minute Papers","sourceKind":"youtube","publishedAt":"2026-10-30T15:57:16Z","summary":"","score":0},{"id":"81115b0ac9556e9f","title":"How Gen uses ChatGPT Work to turn data Into decisions | OpenAI","url":"https://www.youtube.com/shorts/7TtGMileCus","source":"YouTube: OpenAI","sourceKind":"youtube","publishedAt":"2026-10-30T15:24:48Z","summary":"","score":0},{"id":"38dc606742897ede","title":"How Gen uses ChatGPT Work to turn data Into decisions | OpenAI","url":"https://www.youtube.com/watch?v=Oi9DHk57KeQ","source":"YouTube: OpenAI","sourceKind":"youtube","publishedAt":"2026-10-30T15:22:47Z","summary":"","score":0},{"id":"59f6d65d37adcecb","title":"ai-boost/awesome-prompts: Curated prompts, frameworks and papers for LLMs and agents, with an engineering bias. Prompt engineering, context engineering, agent harnesses, red teaming.","url":"https://github.com/ai-boost/awesome-prompts","source":"GitHub","sourceKind":"github","publishedAt":"2026-10-30T11:06:23Z","summary":"Curated prompts, frameworks and papers for LLMs and agents, with an engineering bias. Prompt engineering, context engineering, agent harnesses, red teaming.","score":9160},{"id":"4ec3af8007e2d1b8","title":"ChatGPT Enterprise at Zendesk: Putting Company Data to Work","url":"https://www.youtube.com/shorts/GNYHDltnwZQ","source":"YouTube: OpenAI","sourceKind":"youtube","publishedAt":"2026-10-29T22:48:11Z","summary":"","score":0},{"id":"7d1ea1d6ba1a69c6","title":"WenyuChiou/awesome-agentic-ai-zh: A trilingual (繁中 / English / 简中) learning roadmap for agentic AI: from LLM basics to multi-agent systems, with 240+ curated resources and hands-on examples. 中文 AI agent 學習地圖。","url":"https://github.com/WenyuChiou/awesome-agentic-ai-zh","source":"GitHub","sourceKind":"github","publishedAt":"2026-10-29T19:30:29Z","summary":"A trilingual (繁中 / English / 简中) learning roadmap for agentic AI: from LLM basics to multi-agent systems, with 240+ curated resources and hands-on examples. 中文 AI agent 學習地圖。","score":8318},{"id":"7b1c2982dc3ab07a","title":"ChatGPT Enterprise at Zendesk: Putting Company Data to Work","url":"https://www.youtube.com/watch?v=L6pzlo1QvoM","source":"YouTube: OpenAI","sourceKind":"youtube","publishedAt":"2026-10-29T16:23:43Z","summary":"","score":0},{"id":"1261f03c93da61bd","title":"rohitg00/ai-engineering-from-scratch: Learn AI Engineering! Learn it. Build it. Ship it for others.","url":"https://github.com/rohitg00/ai-engineering-from-scratch","source":"GitHub","sourceKind":"github","publishedAt":"2026-10-29T15:07:57Z","summary":"Learn AI Engineering! Learn it. Build it. Ship it for others.","score":75995},{"id":"a110c1c6ff5d5bc6","title":"datawhalechina/zero-to-sglang: Official SGLang x Datawhale course on LLM inference: understand inference, build a mini-sglang from scratch, then read the real SGLang source and land your first PR. Available in English and Chinese.","url":"https://github.com/datawhalechina/zero-to-sglang","source":"GitHub","sourceKind":"github","publishedAt":"2026-10-29T13:25:05Z","summary":"Official SGLang x Datawhale course on LLM inference: understand inferen